{
  "schemaVersion": "apollo.component-contract.v2-experimental",
  "documentType": "component-contract",
  "status": "experimental",
  "runtimePolicy": {
    "consumedByApollo": false,
    "publishedToRuntimeIndexes": false,
    "purpose": "Cross-component RuleIR capability discovery"
  },
  "package": {
    "id": "web-corp.card-swiper-mobile",
    "family": "CardSwiperMobile [M]",
    "library": "Web _ Corp Components",
    "sourcePath": "JSONS/web/components/web-corp/CardSwiperMobile [M]",
    "sourceGeneratedAt": "2026-07-27T12:58:40.628Z",
    "sourceExportVersion": "0.1.0-rest",
    "sourceFiles": [
      {
        "file": "JSONS/web/components/web-corp/CardSwiperMobile [M]/README.md",
        "bytes": 7808,
        "sha256": "b0aa727fd8fab49b9c5a57592979daa119ba3ba566233a5dbfd9c9223e087050"
      },
      {
        "file": "JSONS/web/components/web-corp/CardSwiperMobile [M]/agent-context.json",
        "bytes": 10418,
        "sha256": "356e22767b552ad5045347492a36d2ca2d3a2951b624559cee8668eead0ed2a6"
      },
      {
        "file": "JSONS/web/components/web-corp/CardSwiperMobile [M]/audit-mapping.json",
        "bytes": 12095,
        "sha256": "ee2be739ce1256afa8be04090834b79b778ae41bfb4094a7737f828a7244b2cf"
      },
      {
        "file": "JSONS/web/components/web-corp/CardSwiperMobile [M]/composition-contract.json",
        "bytes": 20809,
        "sha256": "6f7e291bb097c496aa2fc26175f0a8d172a317967804326d865cb6f53300aa5f"
      },
      {
        "file": "JSONS/web/components/web-corp/CardSwiperMobile [M]/contract.generated.json",
        "bytes": 60286,
        "sha256": "f2391d0c84fd2cbe9f6ff1e50deec6c5687a09837649c87a43808844aee2473a"
      },
      {
        "file": "JSONS/web/components/web-corp/CardSwiperMobile [M]/contract.overrides.json",
        "bytes": 7572,
        "sha256": "b3739cf8fe7759961ce3bdbac2935ad6314a0c8a66a231e08f5de10f396bd34e"
      },
      {
        "file": "JSONS/web/components/web-corp/CardSwiperMobile [M]/examples.json",
        "bytes": 8185,
        "sha256": "c1705991a67705d516e4add11943ad36cafa7eee37d5d38ee892999faa20b742"
      },
      {
        "file": "JSONS/web/components/web-corp/CardSwiperMobile [M]/rules.json",
        "bytes": 18095,
        "sha256": "ec69a8d03d17a5617fe8b7b88c6573f2d40d8b3e5246c9d419a05e543f8d1be6"
      }
    ]
  },
  "capabilities": {
    "selectorVersion": 2,
    "factModelVersion": 1,
    "ruleIrVersion": 2,
    "selectors": [
      "component-identity",
      "descendant",
      "document-order",
      "self-and-descendants",
      "visibility"
    ],
    "facts": [
      "baseline.effective",
      "component-api.contract",
      "component.identity",
      "effects",
      "layout.properties",
      "node.documentOrder",
      "node.visibility",
      "opacity",
      "ownership.owner",
      "paint.fill",
      "paint.stroke",
      "style.text",
      "target.componentKey",
      "target.variant.properties",
      "text.characters",
      "variable.binding",
      "variant.properties"
    ],
    "operators": [
      "classificationPolicy",
      "componentApiValid",
      "countBetween",
      "matchesEffectiveBaseline",
      "sequenceEquals"
    ],
    "remediations": [
      "rule-defined-remediation",
      "set-variant-properties"
    ],
    "unknownCapabilityPolicy": "unsupported-fail-closed",
    "missingEvidencePolicy": "unknown-never-violation"
  },
  "facts": {
    "componentApi": [
      {
        "id": "card-swiper-mobile.universal",
        "name": "CardSwiperMobile",
        "componentKey": "71276eaed89138c3a234084b2f7339019a558aec",
        "componentKeys": [
          "0ccaf9d784aa8b603d6229a898f46433ee74b925",
          "71276eaed89138c3a234084b2f7339019a558aec",
          "d115bb68174c21fe7475748dc31f651221db4558"
        ],
        "platform": "universal",
        "status": "active",
        "publicApi": {
          "properties": {
            "Screen Size": [
              "320-360",
              "360+"
            ]
          },
          "allowedCombinations": [
            {
              "Screen Size": "360+"
            },
            {
              "Screen Size": "320-360"
            }
          ]
        },
        "evidence": {
          "source": "JSONS/web/components/web-corp/CardSwiperMobile [M]/contract.generated.json",
          "anatomyCount": 8,
          "structureNodeCount": 76
        }
      }
    ],
    "selectors": {
      "host.package": {
        "scope": "selection-root",
        "where": {
          "componentKey": {
            "op": "oneOf",
            "values": [
              "0ccaf9d784aa8b603d6229a898f46433ee74b925",
              "71276eaed89138c3a234084b2f7339019a558aec",
              "d115bb68174c21fe7475748dc31f651221db4558"
            ]
          }
        }
      },
      "tree.package": {
        "scope": "self-and-descendants",
        "from": "host.package",
        "occurrence": "all",
        "orderBy": "document"
      },
      "tree.package-components": {
        "scope": "self-and-descendants",
        "from": "host.package",
        "where": {
          "componentKey": {
            "op": "oneOf",
            "values": [
              "0ccaf9d784aa8b603d6229a898f46433ee74b925",
              "71276eaed89138c3a234084b2f7339019a558aec",
              "d115bb68174c21fe7475748dc31f651221db4558"
            ]
          }
        },
        "occurrence": "all",
        "orderBy": "document"
      },
      "tree.semantic-targets": {
        "scope": "descendants",
        "from": "host.package",
        "where": {
          "semanticRoleOrLayerName": {
            "op": "oneOf",
            "values": [
              "↕ SpacingVertical",
              "CardImage",
              "CardsCollection",
              "CardSwiperMobile",
              "CardSwiperMobile [M]",
              "LeftCardWrapper",
              "RightCardWrapper"
            ]
          }
        },
        "occurrence": "all",
        "orderBy": "document"
      },
      "composition.card-swiper-mobile.card-window": {
        "scope": "descendants",
        "from": "$host",
        "where": {
          "componentName": {
            "op": "oneOf",
            "values": [
              "CardImage"
            ]
          }
        },
        "occurrence": "all",
        "orderBy": "document"
      },
      "composition.card-swiper-mobile.vertical-spacing": {
        "scope": "descendants",
        "from": "$host",
        "where": {
          "componentName": {
            "op": "oneOf",
            "values": [
              "↕ SpacingVertical"
            ]
          }
        },
        "occurrence": "all",
        "orderBy": "document"
      }
    },
    "baseline": {
      "source": "JSONS/web/components/web-corp/CardSwiperMobile [M]/composition-contract.json#/manual/standaloneBaselines",
      "resolution": "effective-component-variant-and-owner-context"
    }
  },
  "rules": [
    {
      "id": "rule-ir:web-corp.card-swiper-mobile.component-api",
      "source": {
        "file": "JSONS/web/components/web-corp/CardSwiperMobile [M]/contract.generated.json",
        "sourceRuleIds": []
      },
      "severity": "error",
      "enforcement": "enforced",
      "select": {
        "host": "host.package",
        "targets": "tree.package-components"
      },
      "when": {
        "op": "evidenceComplete"
      },
      "assert": {
        "op": "componentApiValid",
        "validate": [
          "known-properties",
          "allowed-values",
          "allowed-combinations"
        ]
      },
      "verdict": {
        "pass": "expected",
        "fail": "violation",
        "unknown": "unknown"
      },
      "evidence": [
        "component-api.contract",
        "target.componentKey",
        "target.variant.properties"
      ],
      "remediation": {
        "kind": "set-variant-properties",
        "target": "$failingTarget",
        "properties": "$nearestAllowedCombination"
      },
      "presentation": {
        "message": "Component properties must match the published API.",
        "group": "component-properties"
      },
      "capabilities": {
        "selectors": [
          "component-identity",
          "self-and-descendants"
        ],
        "facts": [
          "component-api.contract",
          "target.componentKey",
          "target.variant.properties"
        ],
        "operators": [
          "componentApiValid"
        ],
        "remediations": [
          "set-variant-properties"
        ]
      }
    },
    {
      "id": "rule-ir:web-corp.card-swiper-mobile.card-swiper-mobile.card-window.card-count",
      "source": {
        "file": "JSONS/web/components/web-corp/CardSwiperMobile [M]/composition-contract.json",
        "sourceRuleIds": []
      },
      "severity": "error",
      "enforcement": "enforced",
      "select": {
        "host": {
          "scope": "selection-root",
          "where": {
            "componentKey": {
              "op": "oneOf",
              "values": [
                "0ccaf9d784aa8b603d6229a898f46433ee74b925",
                "71276eaed89138c3a234084b2f7339019a558aec",
                "d115bb68174c21fe7475748dc31f651221db4558"
              ]
            }
          }
        },
        "targets": {
          "scope": "descendants",
          "from": "$host",
          "where": {
            "componentName": {
              "op": "oneOf",
              "values": [
                "CardImage"
              ]
            }
          },
          "occurrence": "all",
          "orderBy": "document"
        }
      },
      "when": {
        "op": "evidenceComplete"
      },
      "assert": {
        "op": "countBetween",
        "min": 3,
        "max": 3
      },
      "verdict": {
        "pass": "expected",
        "fail": "violation",
        "unknown": "unknown"
      },
      "evidence": [
        "component.identity",
        "node.documentOrder",
        "node.visibility",
        "variant.properties"
      ],